<?xml version="1.0" encoding="UTF-8"?>
<?xml-stylesheet type="text/xsl" href="exam.xsl" ?>
<Menu xmlns:xsi="http://www.w3.org/2001/XMLSchema-instance" xsi:noNamespaceSchemaLocation="exam.xsd">
  <Food Type="Salad">
    <Name>Name</Name>
    <Price>$100</Price>
    <Description>Descriptionderewrtetrtrryrutyuitutyutyutyuytuytutyuytutyutyuty</Description>
    <Calories>1</Calories>
  </Food>
  
  <Food Type="Salad">
    <Name>Namedddddddddddddddddddddddd</Name>
    <Price>$100</Price>
    <Description>Descriptionderewrtetrtrryrutyuitutyutyutyuytuytutyuytutyutyuty</Description>
    <Calories>1</Calories>
  </Food>
  
  <Food Type="Salad">
    <Name>Name</Name>
    <Price>$100</Price>
    <Description>Descriptionderewrtetrtrryrutyuitutyutyutyuytuytutyuytutyutyuty</Description>
    <Calories>1</Calories>
  </Food>
</Menu>
